{
  "schema_version": "0.1.0",
  "trace_id": "demo-trace-ranking",
  "task_id": "harden-repo-map-ranking",
  "title": "Harden repo map ranking",
  "started_at": "2026-03-18T05:09:03+00:00",
  "events": [
    {
      "timestamp": "2026-03-18T05:09:08+00:00",
      "stage": "investigate",
      "summary": "Verified that deterministic ranking still depends only on static heuristics.",
      "files": [
        "src/aidrp/repo_map.py"
      ],
      "commands": [
        "python -m unittest discover -s tests -v"
      ],
      "outcome": "Keep ranking deterministic and dependency-free"
    }
  ]
}
